[
  {
    "id": 1,
    "name": "AI客服问答Bot",
    "priceRange": "800-2000",
    "deliveryDays": "2-3天",
    "difficulty": 2,
    "suitableForFirst": true,
    "targetCustomers": ["电商店铺", "教育培训机构", "本地服务商"],
    "description": "基于Dify/Coze搭建的问答Bot，接入客户提供的FAQ文档",
    "deliverables": ["问答Bot搭建", "FAQ文档接入", "微信/网页接入", "操作说明视频", "使用说明PDF"],
    "pricing": { "basic": 800, "standard": 1200, "premium": 2000 },
    "salesPitch": "你每天回复客户消息花多少时间？我帮你搭一个AI客服，把常见问题全自动化，客户问什么秒回什么。800块搞定，2天交付。",
    "riskPoints": ["客户FAQ质量太差", "客户期望过高", "微信接入技术限制"],
    "antiRisk": ["收到FAQ后先整理标准化", "交付前用10个问题测试", "合同写明基于FAQ回答"]
  },
  {
    "id": 2,
    "name": "自动化工作流搭建",
    "priceRange": "1000-3000",
    "deliveryDays": "3-5天",
    "difficulty": 3,
    "suitableForFirst": true,
    "targetCustomers": ["电商运营团队", "留学机构", "内容团队"],
    "description": "基于n8n/Coze搭建的自动化工作流",
    "deliverables": ["自动化工作流搭建", "流程图说明文档", "操作演示视频", "1周免费维护"],
    "pricing": { "basic": 1000, "standard": 2000, "premium": 3000 },
    "salesPitch": "你们团队每天花多少时间在整理表格和发通知上？我帮你们搭一套自动化流程，数据进来自动整理、自动通知、自动存档。1000块起。",
    "riskPoints": ["客户系统没有API", "需求描述不准确", "数据量大时性能问题"],
    "antiRisk": ["接单前确认所有系统有API", "先做MVP给客户看", "测试时用真实数据量跑"]
  },
  {
    "id": 3,
    "name": "AI产品原型Demo",
    "priceRange": "1500-5000",
    "deliveryDays": "2-5天",
    "difficulty": 3,
    "suitableForFirst": true,
    "targetCustomers": ["创业者", "产品经理", "需要融资演示的团队"],
    "description": "可交互的前端原型，部署到公网可访问的链接",
    "deliverables": ["可交互前端原型", "公网部署链接", "GitHub源代码", "演示视频"],
    "pricing": { "basic": 1500, "standard": 3000, "premium": 5000 },
    "salesPitch": "你有想法想验证？我能2天给你做出一个能跑的Demo，你拿着就能去见投资人。3000块，比找外包快10倍便宜10倍。",
    "riskPoints": ["客户不断加功能", "期望Demo能真正处理数据", "审美分歧"],
    "antiRisk": ["合同写死页面数量和功能", "明确告知是前端原型", "先出风格方向让客户选"]
  },
  {
    "id": 4,
    "name": "RAG知识库搭建",
    "priceRange": "2000-6000",
    "deliveryDays": "3-7天",
    "difficulty": 3,
    "suitableForFirst": false,
    "targetCustomers": ["咨询公司", "教育培训机构", "有大量产品文档的企业"],
    "description": "基于Dify/FastGPT的RAG问答系统",
    "deliverables": ["RAG问答系统", "文档导入配置", "准确率测试报告", "操作说明文档"],
    "pricing": { "basic": 2000, "standard": 4000, "premium": 6000 },
    "salesPitch": "你们公司那些文档，新人要看多久才能上手？我帮你搭一个AI知识库，问什么答什么，新人入职第一天就能查资料。",
    "riskPoints": ["文档格式混乱", "检索效果差", "文档更新后知识库没同步"],
    "antiRisk": ["接单前先看文档样例", "交付前做10个测试问答", "提供文档更新教程"]
  },
  {
    "id": 5,
    "name": "电商产品图批量生成",
    "priceRange": "1500-5000",
    "deliveryDays": "3-5天",
    "difficulty": 2,
    "suitableForFirst": true,
    "targetCustomers": ["电商卖家", "品牌方", "跨境电商"],
    "description": "AI电商视觉方案，产品主图和详情页配图批量生成",
    "deliverables": ["产品主图20张", "详情页配图10张", "风格确认稿3张", "源文件"],
    "pricing": { "basic": 1500, "standard": 3000, "premium": 5000 },
    "salesPitch": "你上新一次产品图花多少钱？我用AI帮你做，20张主图1500块，3天交付。效果不比摄影棚差，关键是快。",
    "riskPoints": ["AI生成图与实物差距大", "客户反复修改细节", "生成图片有AI感"],
    "antiRisk": ["先出3张风格稿确认方向", "合同写明风格确认后不接受整体修改", "每张图后期人工检查"]
  },
  {
    "id": 6,
    "name": "自媒体配图方案",
    "priceRange": "800-2000",
    "deliveryDays": "2-3天",
    "difficulty": 2,
    "suitableForFirst": true,
    "targetCustomers": ["自媒体博主", "内容团队", "MCN机构"],
    "description": "自媒体AI配图月度方案",
    "deliverables": ["月度配图30张", "统一风格模板", "提示词模板", "1次风格调整"],
    "pricing": { "basic": 800, "standard": 1200, "premium": 2000 },
    "salesPitch": "你每天花多少时间找配图？我给你做月度方案，30张图800块，风格统一。省下来的时间多写两篇稿子，流量不就来了？",
    "riskPoints": ["客户每周都要改风格", "30张图质量参差不齐", "客户觉得太贵"],
    "antiRisk": ["首次交付确定风格并锁定", "批量生成后人工筛选", "强调省时间的价值"]
  },
  {
    "id": 7,
    "name": "AI简历优化系统",
    "priceRange": "500-1500",
    "deliveryDays": "1-2天",
    "difficulty": 1,
    "suitableForFirst": true,
    "targetCustomers": ["求职者", "应届生", "想跳槽的职场人"],
    "description": "AI简历诊断+优化",
    "deliverables": ["AI简历诊断报告", "优化后的简历", "面试问题预测"],
    "pricing": { "basic": 500, "standard": 800, "premium": 1500 },
    "salesPitch": "你投了多少简历没回复？问题可能不在你的经历，而在简历写法。500块，我帮你做一份AI诊断报告。不满意全额退款。",
    "riskPoints": ["客户期望保证拿到面试", "客户信息太少", "客户觉得只给一个文档不值"],
    "antiRisk": ["明确告知不保证面试结果", "信息不足先打电话补充", "交付物要专业精美"]
  },
  {
    "id": 8,
    "name": "企业微信/飞书Bot",
    "priceRange": "1500-4000",
    "deliveryDays": "3-5天",
    "difficulty": 3,
    "suitableForFirst": false,
    "targetCustomers": ["使用企业微信/飞书的团队"],
    "description": "企业IM智能助手",
    "deliverables": ["企业微信/飞书Bot", "知识库接入", "管理后台说明", "1周免费维护"],
    "pricing": { "basic": 1500, "standard": 2500, "premium": 4000 },
    "salesPitch": "你们团队每天在飞书/企业微信里问HR多少重复问题？我帮你们加一个AI助手，员工问什么秒回什么。",
    "riskPoints": ["企业微信审核流程慢", "飞书版本不支持Bot", "知识库更新不及时"],
    "antiRisk": ["提前告知审核时间", "接单前确认飞书版本", "提供知识库更新教程"]
  },
  {
    "id": 9,
    "name": "数据看板Dashboard",
    "priceRange": "2000-8000",
    "deliveryDays": "5-10天",
    "difficulty": 4,
    "suitableForFirst": false,
    "targetCustomers": ["电商卖家", "运营团队", "小型企业"],
    "description": "业务数据可视化看板",
    "deliverables": ["可交互数据看板", "数据源对接", "部署链接", "数据更新说明"],
    "pricing": { "basic": 2000, "standard": 4000, "premium": 8000 },
    "salesPitch": "数据散落在各个平台，想看全局数据要登录好几个后台？我帮你做一个数据看板，所有数据一目了然。",
    "riskPoints": ["数据源对接复杂", "数据量大时性能问题", "客户期望实时更新"],
    "antiRisk": ["接单前确认数据源有API", "先做静态看板验证效果", "明确数据更新频率"]
  },
  {
    "id": 10,
    "name": "AI内容批量生成方案",
    "priceRange": "1000-3000",
    "deliveryDays": "2-4天",
    "difficulty": 2,
    "suitableForFirst": true,
    "targetCustomers": ["自媒体博主", "内容团队", "MCN机构"],
    "description": "AI内容批量生成工作流",
    "deliverables": ["内容生成工作流", "定制Prompt模板", "使用教程"],
    "pricing": { "basic": 1000, "standard": 2000, "premium": 3000 },
    "salesPitch": "你每天花多少时间写内容？我帮你搭一套AI内容生成工具，输入主题就能出文章，风格跟你自己写的一样。",
    "riskPoints": ["AI味太重", "内容原创性问题", "客户期望无限次调整"],
    "antiRisk": ["在Prompt中加入去AI化指令", "交付时附带查重建议", "明确修改次数限制"]
  },
  {
    "id": 11,
    "name": "品牌IP形象设计",
    "priceRange": "3000-10000",
    "deliveryDays": "7-14天",
    "difficulty": 3,
    "suitableForFirst": false,
    "targetCustomers": ["品牌方", "创业者", "需要IP形象的企业"],
    "description": "AI辅助品牌IP形象设计",
    "deliverables": ["IP形象设计", "多角度展示", "应用场景图", "源文件"],
    "pricing": { "basic": 3000, "standard": 6000, "premium": 10000 },
    "salesPitch": "想做一个品牌IP形象？传统设计公司要几万块，我用AI辅助，3000块起，7天交付，效果不比专业设计差。",
    "riskPoints": ["风格不符合客户预期", "IP形象一致性问题", "客户反复修改"],
    "antiRisk": ["先出3个风格方向让客户选", "合同写明修改次数", "提供多角度展示"]
  },
  {
    "id": 12,
    "name": "AI自动化培训课程",
    "priceRange": "2000-8000",
    "deliveryDays": "5-10天",
    "difficulty": 3,
    "suitableForFirst": false,
    "targetCustomers": ["企业", "培训机构", "个人学习者"],
    "description": "AI工具使用培训课程",
    "deliverables": ["培训课程内容", "实操练习", "课件PPT", "录播视频"],
    "pricing": { "basic": 2000, "standard": 5000, "premium": 8000 },
    "salesPitch": "想让团队学会用AI提效？我帮你做一套定制化培训课程，从入门到实战，5天搞定。",
    "riskPoints": ["学员基础参差不齐", "培训效果难量化", "客户期望过高"],
    "antiRisk": ["先了解学员基础", "提供分级课程", "设置合理的学习目标"]
  },
  {
    "id": 13,
    "name": "投研数据自动化",
    "priceRange": "3000-10000",
    "deliveryDays": "5-10天",
    "difficulty": 4,
    "suitableForFirst": false,
    "targetCustomers": ["投研个人", "投顾团队", "金融机构"],
    "description": "投研数据自动抓取、整理、分析",
    "deliverables": ["数据自动抓取系统", "自动报告生成", "数据看板", "维护文档"],
    "pricing": { "basic": 3000, "standard": 6000, "premium": 10000 },
    "salesPitch": "每天花多少时间在数据整理上？我帮你做投研数据自动化，数据自动抓取、自动整理、自动生成图表。",
    "riskPoints": ["数据源不稳定", "数据格式变化", "客户期望实时数据"],
    "antiRisk": ["接单前确认数据源稳定性", "设计容错机制", "明确数据更新频率"]
  },
  {
    "id": 14,
    "name": "全套AI工具交付包",
    "priceRange": "8000-50000",
    "deliveryDays": "14-30天",
    "difficulty": 5,
    "suitableForFirst": false,
    "targetCustomers": ["中大型企业", "需要全面AI化的团队"],
    "description": "全套AI工具定制化交付",
    "deliverables": ["全套AI工具", "系统集成", "培训文档", "长期维护方案"],
    "pricing": { "basic": 8000, "standard": 25000, "premium": 50000 },
    "salesPitch": "想全面拥抱AI？我帮你做一套完整的AI工具包，从客服到内容到数据分析，全面提升效率。",
    "riskPoints": ["项目周期长风险大", "需求变更频繁", "系统集成复杂"],
    "antiRisk": ["分阶段交付", "合同写死需求范围", "设置里程碑验收点"]
  }
]
